{
    "$schema": "http://json-schema.org/schema#",
    "properties": {
        "generation": {
            "properties": {
                "name": {
                    "type": "string"
                },
                "url": {
                    "type": "string"
                }
            },
            "required": [
                "name",
                "url"
            ],
            "type": "object"
        },
        "id": {
            "type": "integer"
        },
        "move_learn_methods": {
            "items": {
                "properties": {
                    "name": {
                        "type": "string"
                    },
                    "url": {
                        "type": "string"
                    }
                },
                "required": [
                    "name",
                    "url"
                ],
                "type": "object"
            },
            "type": "array"
        },
        "name": {
            "type": "string"
        },
        "order": {
            "type": "integer"
        },
        "pokedexes": {
            "items": {
                "properties": {
                    "name": {
                        "type": "string"
                    },
                    "url": {
                        "type": "string"
                    }
                },
                "required": [
                    "name",
                    "url"
                ],
                "type": "object"
            },
            "type": "array"
        },
        "regions": {
            "items": {
                "properties": {
                    "name": {
                        "type": "string"
                    },
                    "url": {
                        "type": "string"
                    }
                },
                "required": [
                    "name",
                    "url"
                ],
                "type": "object"
            },
            "type": "array"
        },
        "versions": {
            "items": {
                "properties": {
                    "name": {
                        "type": "string"
                    },
                    "url": {
                        "type": "string"
                    }
                },
                "required": [
                    "name",
                    "url"
                ],
                "type": "object"
            },
            "type": "array"
        }
    },
    "required": [
        "generation",
        "id",
        "move_learn_methods",
        "name",
        "order",
        "pokedexes",
        "regions",
        "versions"
    ],
    "type": "object"
}