{
    "generation": {
        "name": "generation-iv",
        "url": "http://127.0.0.1:8000/api/v2/generation/4/"
    },
    "id": 9,
    "move_learn_methods": [
        {
            "name": "level-up",
            "url": "http://127.0.0.1:8000/api/v2/move-learn-method/1/"
        },
        {
            "name": "egg",
            "url": "http://127.0.0.1:8000/api/v2/move-learn-method/2/"
        },
        {
            "name": "tutor",
            "url": "http://127.0.0.1:8000/api/v2/move-learn-method/3/"
        },
        {
            "name": "machine",
            "url": "http://127.0.0.1:8000/api/v2/move-learn-method/4/"
        },
        {
            "name": "light-ball-egg",
            "url": "http://127.0.0.1:8000/api/v2/move-learn-method/6/"
        },
        {
            "name": "form-change",
            "url": "http://127.0.0.1:8000/api/v2/move-learn-method/10/"
        }
    ],
    "name": "platinum",
    "order": 11,
    "pokedexes": [
        {
            "name": "extended-sinnoh",
            "url": "http://127.0.0.1:8000/api/v2/pokedex/6/"
        }
    ],
    "regions": [
        {
            "name": "sinnoh",
            "url": "http://127.0.0.1:8000/api/v2/region/4/"
        }
    ],
    "versions": [
        {
            "name": "platinum",
            "url": "http://127.0.0.1:8000/api/v2/version/14/"
        }
    ]
}
